review,rating
"Great hotel in the heart of Rabat! the rooms are clean, the hallways smell exceptionally good! every single employee is detail oriented and cared about us. If you want to feel ""ROYAL"" then The View Hotel is the place to be! We also tried the famous restaurant located in the 15th floor that is called The Legend; WooW! The view is exceptional, food quality is amazing and the service is smooth and friendly! THANK YOU! We will be back to try the coffee shop located on the 14th floor.",5
"I'm tempted to rate this hotel as ""poor"" but that probably wouldn't be fair.  The room is clean and comfortable although lighting is terrible.  I guess ""soft lighting"" is in fashion.  If you are a woman who puts on make-up in the bathroom, good luck to you!  You get a make-up mirror but not enough lighting to see what you are doing.  My biggest problem was that I left sunglasses in the room when I left for a weekend tour.  I realized it quickly after leaving but I knew I would be back in a couple of days so asked our driving to call the hotel and ask them to retrieve the glasses from the room and hold them at the Reception Desk.  When I returned a few days later, they had no idea what I was talking about. No one seemed to be able to track the glasses.  I called the front desk repeatedly.  Finally, at 11 pm, someone showed up at the door with sunglasses.  They weren't mine.  I was told it would be solved in the morning but I had an early departure.  They did notify me that they found the glasses after I left the country and when I tried to contact them to ask them to send them by courier at my expense I got no answer.  I have a colleague in Rabat.  I felt badly asking him to help me solve this but I did, and he will get my glasses back to me.  The hassle was so unnecessary but it was typical of the lack of service at the hotel throughout.  Check-in was slow.  You hand over your passport, sit in the lobby and just wait for your room key.  Hard to understand why you didn't just register and get your key.  Service in the bar on the 14th floor was slow.  Communication in English was near impossible.  Drinks were terrible and overpriced. Items on the menu didn't seem to be available but communication issues made the process confusing at best. …",4
Great hotel!  Great service.Rooms had wonderful amenities.  Gym is clean and well equipped.  Breakfast was great. Service perfect and friendly   Location was perfect.  Service wonderful. Great value. Would highly recommend it. ,5
Last night we went dinner for dinner at the hotel restaurant the Legend Club and we had the worst experience. The waiters were condescending and basic customer service was non existent. We had to wait 1h30 to get our food while the restaurant was almost empty. The food was mediocre and we were still charged for everything (even after we complained). I would not recommend this place. Very poor service and mediocre food.,1
"This was a business trip for my team and from check-in to check-out was seven days.  The hotel service experience here was outstanding!  From the greeting at the main entry, through check-in, multiple restaurant venues and the hotel amenities, the staff at each venue was gracious, knowledgeable, helpful, and made a genuine effort to meet our needs.  At The Legend Club on the 15th Floor, the venue was very clean and perfectly set-up.  Restaurant supervisor Amine, head waiter Ashraf, and waiter Yussef demonstrated what really great service should look like.  They recommended Moroccan dishes, explained how the chef would prepare them,  and were incredibly attentive.  Our water glasses were refilled regularly and each course was delivered with a flourish.  In the main lobby where we met each day, concierge Fatima greeted us and saw that we had coffee and water every time we sat down.  Our rooms were clean and the bathrooms were spotless!  The surrounding area has numerous shops, restaurants,and is quite safe by continental standards.  We can easily recommend this hotel for business or tourism.  An excellent choice and the price is very reasonable!…",5
"Used to go there before the pandemic and was waiting for it to reopen to go back again. Unfortunately we had the worst experience anyone can have. We were a group of 5 and were stopped by the valet at the door for no reason. He told us the terrace lounge closes at 7pm so it was useless for us to go inside. We found it weird and decided to call the hotel, they explained that the lounge was still open and that we needed no reservation to go. As we went back there, we were received by another security guard who tried to stop us but failed since we were determined to talk to someone and let them know what happened to us. They all started coming up with stupid excuses trying to make us understand that it has nothing to do with what we thought it was. It seems like they all have instructions to filter people based on whatever stupid criteria, while we were complaining at the lobby a group of 5 random girls came in without anyone telling them anything at the front door.  That specific day we decided to drive a Seat Leon instead of the Range Rover sport or the Mercedes class E we basically drive. It could have been a viral social experiment if we intended it to be, it would have been a viral video on Tiktok. It is a shame to judge your customers based on what they drive, you don’t know what they carry on their pockets.  This is what customer’s service is like in morocco.  That 1 star is because i had no other choice, it is a no star place to me. And as an owner of a Travel Agency, i will never recommend it to any of my clients.…",1
"Spent couple of nights, great hotel and service. All was excellent with the service and the room beautiful. Food amazing and breakfast excellent and service very friendly. Front desk were amazing and very helpful. we will come back soon.",5
"Excellent service and very nice staff in reception and breakfast service I would like to thank all the staff in the hotel, especially the employee name is (Ayoub), he is very kind and very helpful , all staff are very kind 💐..........................",5
"Excellent Servcie in this modern rabat downtown grandiose venue where I had the chance to spend few business days. The service is rated AAA+, very super friendly staff, extra clean comfortable rooms especially the bed , the pillows, new modern design with 180 degrees tower view on the new city you feel very spoiled. A real definition of a downtown palace. ( near by a lot of shops restaurants coffee shops..)it’s the new rabat fancy area. All the facilities are great: restaurants serves diverses local and international  tasty food while the different atmosphere Are very exquisite,  Also they have the best breakfast buffet in moroccan hôtels with limitless choices all made to the minute: sushi, Salomon, cooking stations, fruits bar, vegetables, a rich combination between locale cuisine and international gastronomy without forgetting the good quality coffees to finish the breakfast in beauty. This Hotel is a must live experience while in rabat…",5
"We stayed here one night while on a group tour.  The hotel is very nice, clean and great staff that works here.  Bed was very comfortable and breakfast was good. Several of my friends went to the spa and they said it was very good service too.  Highly recommend to stay here.",5
"Good location and nice view . perfect staff on front desk, amazing services and recommended for everyone in business or family vacation.  Cooperative with the visitors for anything needed.  Good luck for them.",5
I really felt the staff cared about me as a guest and the meal I had in the restaurant was lovely with the waiter being very aware if I needed anything without being intrusive. The housekeeping was very good and also the laundry service.  Thank you I will come here again,5
"The rooms are decent with some exception: the bed linen has an unpleasant smell. Room service is unfortunately really bad: very slow, expect to wait minimum 60 min to 90-100 minutes for your food delivery. Once your order arrives is usually incomplete or not at the quality you might expect. Whoever is responsible for the food & bevarage department for sure has no clue how to organize his/her team.  Service is terrible!!",1
"The view hotel had been selected for our 3 days stay in Rabat.  We experienced a great stay in all the ways.  Upon arrival a lovely hostess Mrs Jihane welcomed us, offer us a drink and assist with all the check in process.  A nice welcome snack was waiting us in our rooms (was replaced daily with different sweet or salt delicacies)   Our Panoramic rooms were nicely decorated and fully equipped (coffee and tea station also), the WIFI in the rooms and the hotel was very fast. The bathrooms are so luxurious and big. Do not miss to visit the open area bar on the 14th or 15th floor (not sure which floor) where you can enjoy a fantastic cafe au lait or a snack (smoke friendly too). The heated pool is also a place to be!!!! Around the area - which is not a shopping one - you can find…",5
"The air-cond wasn't working and it was 30 degrees inside the rooms. The staff told me to just open my window but they have these huge neons, and horning in the streets whole night. I just couldn't sleep.",1
"Pleasantly surprised.  Welcome drink & cookies. Lobby filled with flowers and lovely music played by pianist. Hotel staff friendly, helpful  and cheerful.  Rooms were big, clean, spacious with bathrobe and slippers plus coffee & tea provided.  Toilets with complete amenities & a  nice powerful hairdryer. Dinner was delicious.  Free WiFi.  ",4
"It was my second visit to Rabat but the first time in this hotel. The services of any place starts from the first hello at the reception and i felt the presence of a real welcoming feeling through eyes and gestures of all staff in this hotel . I stayed five nights that vanished faster than expected and enjoyed peaceful , uninterrupted sleeps .I think this hotel is one of the places that all people will agree upon its success and will score excellent in all reviews in future.",5
"Traveling to Morocco for the first time on a package tour from Hong Kong, the hotel locality is not important but clean, comfortable bed were much welcome after a long haul from home. I particularly liked the bathroom shower, it has a rock bench to sit down. The lift takes a bit trial & error to get to the floor, one of those computer selected lift car type. Breakfast was good and soon after we started the tour around Morocco.",4
"Great day visit spécial thanks to ais ha Who is excellent interpersonal skills and very welcoming to the guests  also location close to mahaj riad (Shops.restaurant, cafés. Etc ) Thé hôtel was easy to reach the staff was very hospitable",5
"Very disappointed by this hotel which is supposed to be one of the best in Rabat. We had a conference and rented 23 rooms. One of the waiter was rude at breakfast. the staff is lost and is apparently not trained. The bed was horrible, the bathroom door was stuck and I could close it. The view from the room was another building. the only nice view was from a glassed elevator. I won't go back",2
"The hotel is a five star hotel. Five stars only in theory. Awful service and overpriced. I am in Rabat for business and i went for dinner tonight. The amateurs have booked the restaurant for a kind of meeting and the rest of the guests are not allowed to go for dinner. There is also a bar that serves something to eat but it was also booked. So i ve been told that i could have dinner either in my room or in 15th floor restaurant which is tooo expensive. I asked for the duty manager and magically they made a table for me. The whole aproach is simply pathetic. The house keeping is also very poor. Facilities in the bathroom were inoperable, they never refillelld the complimentary tea and water in my room. Avoid this hotel. I have been in Rabat 5 times, this the worse hotel…",1
From the comfortable room to the fresh orange juice at breakfast this hotel is worth a visit. I was on a short business trip. A few things need improvement though. I like to do laps in the pool early in the morning.  They should consider opening it before 9. 6 am would be a good idea. The rooms dont really have a chair that you can sit to work along the counter cum desk. Perhaps they have other rooms that you can request that are more work friendly. I stayed in a legend room with a great view. The cedar terrace is a nice place to wind down after a busy day. ,5
"The location is good, but worse housekeeping ever. You will only get a bottle of water once, and no bathroom towel after you used them. It is like you have to ask them for a favor to get the essentials amenities. So, if you are thinking to stay here then think twice.",1
"Sincere and friendly interaction with all staff all of the time from arrival through check out.  Impressive lobby - pleasant, responsive, well groomed and professional attired staff.    Calming, soothing and invigorating scents while waiting for the high tech elevators.  A quiet, beautiful and Exceptionally clean room with plenty of space; inviting bed with plush pillows.  Great TV and working remote (100% connection from remote to tv when switching channels).    Love the bathroom; especially the shower (lots of space) and shower heads (great flow and pressure).  We extended our stay for a day at the View (to visit Tangier and a quick trip via ferry to Spain for lunch and to see Gibraltar).  Came back to a pleasant after noon surprise in our room - macaroons, fruit and a sweet…",5
"This is my second times here in this hotel. What I like about this place is all about the services. Every hotel staff is so nice and friendly, they are so helpful and they can recognize there guest each one of them. This is a charming of people who pay attention on there job. The room is nice and clean with everything you need; big wall flat screen tv, big bed , big shower and toilet. The breakfast is also great with all variety of food to choose from. They also have a spa and bar with a very nice view. The WIFI signal is very strong through out the hotel premise and it is free. Nice surroundings area with shop and restaurant. I love this hotel.",5
"I came at this wonderful hotel through my work. I adored everything!! The kindness of the staff,the spa services ..the view of the room and especially the morning breakfast buffet which was so varied and delicious, it is for sure that i'll plan to come back and bring my family with me this time!!!",5
"A gem hidden in the hotel, so hidden that even it is not in Tripadvisor. We have been having lunch and dinner few times this week, and previous trips snd it is simple delicious, the best of the hotel! Twice I went to the Legend, another restaurant in the hotel ... it was very disappointing, but Le Sensya is really amazing. Chicken Tajine, John Dory Fiorentine, desserts!! Thursday nights buffet",5
"The amenities and high quality staff responsiveness from everyone janitors, concierges, bar tenders, waiters, elevator attendants, hammam employees are exceptional.  Postal service, assistance working on the 14th floor terrace for business projects makes me feel like this is a home away from home.",5
"I spent two nights at the view hotel, i had a room with an amazing view. The hotel location is close to everything it s in the center of rabat. The staff is very helpful and professional, they helped me during my whole stay.  I recommend it!!",5
"I stayed here while on business in Rabat. The check in took rather a long time but staff were pleasant throughout. The security guys by the entrance to the hotel always had a smile and a hello.    The hotel is very well appointed with a lovely rooftop bar with views over the city.  I really enjoyed the mint tea and cake in the bar.    My room was nice, with a very large shower and an extremely comfortable bed.  Everything was very clean and well maintained and I slept really well.  I ordered room service one night and the French Toast dessert was absolutely amazing.  It was the best thing I ate in Morocco.    Breakfast had a really good range of food on offer.  It was a bit difficult getting someone to come over and take a coffee order.  I think the staff should be a bit more…",4
"I spend the night and checkin was slow but hospitality covered for it as they helped be find a change place and walked with me to make sure. The room was nice, clean but the main thing that wow me was the restaurant on the top floor. The view at sunset was magnificent and the food... the food was 5 stars and great service. This morning breakfast was basic with slow service.",4
"Great hotel with excellent service. The rooms are spacious and very well equipped, with a large bathroom. They serve a very good breakfast with plenty of choices. But most of all, I like the courtesy of the staff. They are very helpful with the ambition to make your stay as comfortable as possible. Especially the professionalism and friendliness of Aicha (PR Manager) deserves a special mention. After more than 10 business related visits, every new stay feels like coming home. I highly recommend this hotel! With a better swimming pool and a smoother service during breakfast, I would certainly rate it excellent.",4
"i really like the ambiance and the courtesy of te personel. i was personally impressed by the manager of the SPA and Gym Coach, Nawal. I agve her AAA ( triple A). very experimented and professional. Gave me a lot of great exercises to do.  the hammam and massage are also a must to try !",5
"The location of this hotel is marvelous.  Plenty of restaurants, businesses and shops are in walking distance.  The staff is helpful and friendly and the decor is modern and well maintained. The rooms are spacious and have all the simple little things you expect in a room like mini refrigerator, clothes iron and kettle.   The restaurant on the terrace has a wonderful view. The food was good and service was fast and good. Breakfast was also good with plenty of different choices and a great omelet station. For a business meeting, I liked this hotel.",4
"I had a great time, service and support. I stayed at the Hotel for 4 nights and everything was excellent. Specially the public relationship manager aicha she was very professional, helpfully and helped me to solve and issue when she heard about it while was walking in the lobby. Also, chaimae at the reception is really awesome and helped me very much during my stay. They follow up on any requests with in minutes... I highly recommend this Hotel in Rabat.",5
"Service is good. But the pool has no sign of how deep the water is. And turned out to be 1.5m and the other side is 2m deep, really scared out of me. There’s also no lifeguard, no life bouy, and the water is too warm like a hot spring, ventilations is poor, anyone who has high blood pressure should really be careful of swimming there. Also I got locked up in the lobby wash room, cuz the lock didn’t work and I couldn’t open the door from inside. Fortunately I finally got out, but the safety awareness should really improve in the View Hotel. ",4
Very nice property with amazing view. Rooms are clean and staff are friendly and would take the extra mile to make your stay even more comfortable. Easy and fast check in and out. Located in a nice area and has a Starbucks nearby which is for me is a plus. ,5
"I spent not much time, but I really enjoyed it. Very comfortable rooms, WiFi and TV that speaks couple languages, just be patient and choose.  Service at the reception could be better, I mean faster and multiclient service, because there is not the only person available. And coordination between personnel shall be better - we paid on arrival, but on departure were asked to pay again. Of course, corrections in the system were made, but it took time and spoiled morning.   If you stay in hotel, try to meet Ms. Aicha. She is super helpful to organize your leisure time - advices where to taste local food, what to see in a city and even arranges transport for your sightseeing if you are limited in time. More over, she is fluent in couple languages, including russian, what was surprise…",4
My 10 year old daughter and I spent 6 nights at The View in Rabat. We were treated so well by the team that I felt I had to write this - not something I ever do! The hotel and spa are fabulous. We were looked after particularly well by Aïcha concierge who organized the perfect half day tour of Rabat and Chaime at reception who helped us extend our reservation.  Thank you all for a memorable stay,5
"Given the cost, one would expect towels, showercap etc sheer basic elements, but I had to ask!. No water available in the room to drink. Fridge empty. Cuisine not great either.  Staff v polite. Management needs to wake up and address these problems. Will be going back to using Hotel Tour Hassan in Agdal next time. Far superior service for same price!",3
"Given that this is listed as a luxury hotel and is located In the business district one would expect a swift check in. With only one receptionist to check in travellers it takes more than 30 minutes ! Response was - this is how it is and they have no additional staff!  No sorry, no empathy at all !   Definitely bad customer service. ",3
"Located minutes away from Rabat city center.  Hotel, 5-star hotel features rooms and suites, bar, cafe and restaurant and MICE area. Complimentary open air parking. Non wheelchair accessible.  The legend club, international and Moroccan gastronomy restaurant, lunch and dinner. Restaurant features non-smoking indoor seats over a few tables of two and four persons. Ambience is intimate, Jazz lounge and Arabic music with a live band with singer, piano, drum and Oud, an arabic guitar, subdued light, simple modern furniture and decoration, floor-to-ceiling glass windows, panorama over Rabat city. Menu proposes a couple of vegetarian options, a many pescatarian and non vegetarian options, alcoholic and non-alcoholic beverages. Menu is inspired of international and Moroccan gastronomy,…",4
"I stayed at The View last week for several days in January.  I noticed the security at the front immediately. There is a metal detector and several security men.  I felt very safe. My check-in was very quick and easy.  The staff was very helpful at getting me to my room and taking care of my luggage.  My room was very large and comfortable.  The bathroom also was very large and luxurious with a really interesting shower.  I didn't eat at the restaurant but the neighborhood is near shops, banks (and ATMs), and other restaurants.  I had a wonderful stay.  The hotel booked a driver and car for myself and two friends and we had a wonderful day traveling in Morocco.  My only issue was that one night I went to sleep early (around 8 pm) and a woman opened my room door with a keycard…",5
"Really enjoyed my time in the lounge (cedar), view, service and menu. All with a high standard for a luxurious place. Special thanks to Kamal and Bouchaib for their good service and professionalism, which i really appreaciate . Many thanks to all The View team",5
"This newly built hotel is located in one of the nicest streets in Rabat, next to restaurants, cafes and shops.  The staff are very professional, the rooms are modern, clean and fully equipped.  Restaurants and other facilities were professionally organised and managed. I strongly recommend this hotel if you have a buiness trip to the Moroccan capital",4
"No kidding around. The view is the best hotel I’ve stayed in while in Morocco.  The location is close to some very good mid- price range restaurants.  About $4 US cab ride 15 minutes to the pier and Medina. But, like anywhere it’s the people and the service. I felt at home right when I got out of the cab. Top to bottom the staff is friendly without pretense. Specifically my wife and I want to mention: Ghizlane,Jihane,soukaina,achraf,jafar-etna mallam-,Raina,- and thistophne. They even took my wife’s broken bracelet home and fixed it for me. It’s the place.",5
"Stayed previously in Casablanca and Marrakech, never thought Rabat would rival these more popular cities in quality of hotel. ""The view"" is definitely the place to say at if ever in Rabat. Subtle quality delivered with ease..",4
The rooms were very nice.  The spa was great! Especially if you get the Hammam! Google Hammam if you don’t know what it is. Rabha was the best Hammam giver!  The location was in the center of town so handy for walking and getting around. The staff was very attentive and helpful. ,5
overall it is a good hotel to stay with peace and surroundings are nice for an evening walk and some good restaurants and a few coffee shops would give opportunity to have evening coffee and dinner alongside the road.,4
"I went to attend a conferance and was positivly surprised about the warm welcoming manners, facilities were fantastic, service room impeccable and spa really relaxing. food amazing as the country is well known for its cuisine :-)",5
It is a clean hotel in a great location service are beautiful but the price a bit high I can recommend this hotel for business people  You can find some different restaurant near to the hotel I have small doubt about the noisy comes from the road and some drivers are playing on the roundabout at night time,4
"Great hotel with beautiful rooms and stunning bathrooms. Breakfast and room service also has good quality of food. The hotel is not located in the city center, but has a few restaurants and coffee shops within walking distance. Would definitely come back.",5
