review,rating
I spent 2 separate nights here getting in late both times. No trouble checking in before midnight. Nice rooms (1 and 3rd floors).  Found the pillows to be a bit hard for my taste but could probably have asked for a change but it was late. Shower section of bathroom lovely...powerful pressure. Didn't have time to take breakfast as had to travel out early.,4
"I spent very good time in this hotel , very friendly hosts, great and beautiful building, very nice rooms, good restaurant, nice spa , the staff is very very good and professional, if I will come to Rabat again I will stay there .",5
"If you look for a convenient and central place to stay in the Capital than this is it.  Clean, friendly, great service.  The soul of the place is definitely Mr. Jafaar from Concierge who expertly and with devotion looks after all your needs and is even assisting after his working hours if need be. Bravo!",5
"A modern luxury hotel. Not cheap, but definitely worth the price. Very clean, good sized rooms. Large TV with plenty of channels in different languages. Modern bathroom. Large safe deposit box, suitable for a laptop. Good Internet connection. Very generous breakfast with a choice of hot and cold buffet, both international and local tastes. Polite and efficient staff - from the front door to the restaurants. Always greeting and smiling. The hotel is located in the middle of the new area of Rabat with lots of business and government offices all around. Plenty of restaurants just at the square and yet more up and down the avenue. Safe and nice looking environment. Very convenient for a business visitor, but a bit far from the tourist attractions in the old city (15-20 min by taxi).",5
"Liked this place. Much smaller than I thought, but what they had was perfectly formed. Great breakfast, small pool (very small), conveniently located with many restaurants surrounding the hotel to choose from. Attentive staff...nothing not to like.",4
"We arrived at the hotel by car after a 3 hour trip with a toddler and a baby to visit family. The staff directly helped us with the luggage and parked our car at the private parking place. Everything was overwhelmingly good. What a service!. From the welcome to opening the door of the car.   One staff member guided us to our hotelroom. She showed us the room, gave us some information about the wifi, breakfast etc. and asked if there was  anything else she could do for us. We told her that we needed a babybed. She directly called her college and offered us also a extra bed for the toddler. Within a few minutes everything arrived. He installed everything even the bedding.  The room was perfectly clean and the size was perfect.  We just stayed one day cause we where going also to…",5
"Very new and nice hotel! Staff friendly and everything is updated! Love the location close to hip and cheap restaurants. Staff spoken good enough English. Very secure hotel, awesome room with see through shower. The fitness was decent could use more equipment. The pool that I saw was indoor and very small. They have some nice restaurants on site with views of the city. I would definitely stay again.",5
This hotel might be alttle away from the Centre but then it is still surrounded by many restaurants. Rooms are if very good size and very well appointed. The staffs are very attentive and efficient too. ,4
I stayed here for 5 nights as training at a venue nearby. My hotel room was spacious and very clean and everything was very nice. Unfortunately there was not a desk and chair so I was not really able to work well in the room. The wifi works very well. My package included breakfast which had quite a wide choice. I ordered room service one night and I also ate at one of the restaurants another night the food was good. I found the staff very helpful and pleasant. I will definitely stay here again.,4
We stayed one night here. The room is big - two queen size beds . Nespresso coffee maker is provided in the room. The toilet is clean. Location is a bit far from the attractions area. Breakfast just average only but the service was good!,4
"I only stayed for one night, so I did not have the opportunity to thoroughly explore the hotel.  There are several restaurants, and the rooms are among the nicest I have experienced anywhere.  The hotel is away from the city center, but in a pretty upscale, business area of the city.  I would recommend this hotel, mainly to businesses travelers or couples. ",4
"Certainly the attempt is to be on top.Luxury,at least five stars.Almost,if they just would not decorate their bathrooms with plastic flowers and warn their guests they would be fined with 2000 drh if they dare to smoke.Right they are,but the tone is menacing and certanly not top.The service in the breakfast service was as perfect as the buffet itself.The waiters were directed by a very talented manager,whose staff was able and friendly..The soup,served our group in the restaurant was warm,at the most,and the dish,although prepared with perfect ingrediences,was not hot either.Possibly we were late,,but top means top.The rooms were perfect,the prices of the minibar,one Heinecken,mini version, five Euros,exagerated,unless you are intending to stop your guests from drinking…",4
"From the welcome by the guys in front to the tearful goodby from the same group, the view is the place. Close to restaurants, the medina and souk are a $3.00 US/15 minutes Moroccan thrill ride away. The staff is friendly, helpful and attentive. So,much so they deserve mention by name- here goes to the best staff I've encountered in Morocco: jafar, khaoula,jihane,mustapha, Sophia,hicham, reda,chaimaio,imane,aicha, meholi,sidimohamed, Samir. Long list I know but if they weren't worth mentioning - I wouldn't take the time. Great place you won't regret it!",5
"The View in Rabat is a new hotel in a great part of the city-- safe, upscale, and very short walking distance to all kinds of restaurants. It's the best/only hotel in the area. It is quite comfortable and the staff are all great.   That said, there are some little things that all add up...People say this is a five star hotel, but it's not...Not at the level of actual international five-stars. The hotel restaurants are odd-- no one ever seems to use the ""dinner"" restaurant (Sensya) on the ground floor...I mean no one.  The ""breakfast"" restaurant is Sahar, which I've only gone to on Sundays...It's almost deserted and they kick you out of Sunday brunch at 1030.  Odd, by any standard. Perhaps the biggest inconvenience is the WiFi...it's horrible.  Just horrible.  Horrible. Next is…",3
"At check in you pay a temporary deposit for the room even though the room was fully paid for by the company. This was cancelled at check out. Room was great, especially the bathroom. Had roomservice and the food met my expectations. ",5
"I've stayed at quite a few hotels across Morocco, and this one comes closest to a high quality hotel you would find in the States or Europe. Everything was in excellent condition, and Jaffar, the concierge, was extremely helpful and courteous. I would highly recommend this hotel to anyone visiting Rabat. It is close by to a variety of great restaurants, to include the new Starbucks in Rabat, Paul's cafe, and the Mahaj Road shopping complex. ",5
"I stay nearly three weeks in the hotel, beneath the warm smiles and the sweet perfume smell in reception the hotel is not a business hotel.  The rooms have no workable desk space, there is no chair to sit and do work and the lighting consists of a standard lamp and two bedside lights there are no reading lamps.  The wi-fi is very poor on a good two you barely manage to get simple emails done, you can forget skype calls or any other business work using the internet.  The bathroom has a large shower unit which is kept clean and plenty of bath robes, slippers and toiletries.  The room is spacious with a huge double comfortable bed.   I was on the 12th floor but was told there was a water problem and after two weeks had to move suddenly to the 9th floor and huge inconvenience.  No…",1
"I am just coming to the end of a 3 week stay at The View and it is 6.20am. Why am I writing this view so early? Because I have been awake since 1am as a 'Private Party' was taking place on the 14th floor. All I could hear was the bass of the PA. The music stopped at 6am!!! The View claims to be a business hotel...what a joke. The internet is very patchy and staff do nothing to improve the situation other than offer a room change. All of my five colleagues experienced terrible internet coverage making emails, conference calls and streaming virtually impossible. I was unable to FaceTime my wife and family without continued breaks in the calls. Emails stacked for days. The only way to maximise Wi-Fi was to sit on a chair in a corridor next to the door to my room. Wi-fi extenders…",1
"nice place,. Nice view from 14th floor bar. But lifts are weird - operated by room key, very fiddly - and when we needed an iron it took five phone calls to get it delivered. Shower also seemed to flood the whole bathroom and drain very slowly. So could have been better, Very attentive staff at breakfast,",3
"We decided to go have a drink at this hotel.  Well well, first I arrived and there is valet parking. free.  Then, the security staff ask you to go through a metal detector in a very nice way as if it were just a suggestion.  Of course you cannot refuse.  Then you meet the secret-service-like team who escorts you to the elevator to the 14th floor.  They even press the button for you.  You arrive and another team takes you over all the way to the two vast rooms where your party is.  They serve almost everything.  The service at the bar and restaurant were excellent as well.  Very impressive.  Will go back.",4
"The staff went out of their way to warmly welcome us each time we entered and ask if there was anything we needed. Stayed for 5 nights and the hospitality got better and better. The outdoor patios and terrace are lovely and the rooms are modern and well-appointed. The internet in the room was weak and the gym was never quite cool enough, are the only two small negatives. Food was excellent. In a great, upbeat, vibrant, and SAFE area. I would definitely stay here again.",5
"if you go to Rabat and want a nice place, close to all types of restaurants- the view simply cannot be beat.  I've been to rabat dozens  of times and always had a great experience.  The view tops them all- great staff, friendly without fawning, quiet rooms, the staff and security were fantastic. Jafar is the man who will see that you are taken care of in every way.  Internet was fair, elevators are supposed to be something from star trek - and were frustrating at first. but overall great experience. Cab is $3 to the market- maybe ten minutes.",5
"Being an architecture student who travels the world, always on the lookout for the best new creations, I decided to stop by and spend a night in this new pinnacle of the capital of Morocco, the exterior being very well designed attracted me to get up close and personal with the hotel, as soon as I walked in, I was greeted with hospitality by the staff, when i told the about my intentions, they gave me a tour of the building and it's facilities, I was impressed by the beauty in the design and the effort put in decorating and the overall warmth of the hotel, before being escorted to my room the receptionist informed me that I was going to be upgraded. I was then escorted to the upgraded room which was a spacious single room. The name does not disappoint, there is a wonderful 180°…",5
"Stayed at the beautiful hotel for 7 nights. Nice facilities but I was most impressed with the staff. I felt welcome every time I was entered and greeted by staff who seemed to truly care about their service. They went out of their way to care for me and my group, were extremely friendly, and by the end of the stay, on a name basis with many of them. I look forward to visiting in the future.  Any negatives such as the odd elevator operation, and warmth of the gym, can be overlooked with simple patience and understanding (calling ahead to cool the gym down for example). The staff and their accommodating attitude more than makes up for anything lacking.",5
There is no internet in your room. I have unfortunately had to stay in this hotel on more than one occasion and there is never internet. When you can they say they will tell IT but nothing improves. You have to stand in the hallway to get any reception at all. The coffee machine had no water and there was no water bottles in the room. The nesspresso capitals were gone except one !!! I called and asked for water and expresso capitulates. It took half a day and me calling three times. I had to sleep during the day and they were Maintenence some were on my floor and all I could hear was banging. When you call reception or room service the phone keeps cutting out. No one speaks English and keeps passing you to someone else. When your frustrated they just laughed. The bed is comfy…,1
"I recently stayed at The View, Rabat's latest new hotel. the highlight is the superb14th floor open air terrace and adjacent bar and lounge. The Views were amazing of the city. the bedroom was one of the most comfortable I have ever stayed in and the hotel and a superb wifi system, throughout the building. The only let down was the below average breakfast which on first appearance looked good but closer inspection and actual sampling was a disappointment. Not a five star service in undoubtedly a five star hotel. That being said, definitely worth a visit as its super luxurious and very well situated in Rabat.",4
"I loved my stay at the View. Brand new hotel! i was impressed by the true Moroccan hospitality as soon as I stepped it till the day I checked out 4 days later. Amazing service! Room is clean, spacious and calm. Exactly what I need for my business travels. The breakfast has a variety of Moroccan and western food. I loved the hotel restaurant too.  The location is hard to beat. Away from the chaos of the old medina, yet close enough to everything you may need; shopping, food, offices, etc.  Highly recommended wether you are on business or fun!",5
This hotel is a new hotel in Rabat they use new technology for the left And home automation service on the room the room are clean the finishing of toilet is beautiful the hotel located in very nice place so you can reach to any place in a Rabat  with short time everything is near to the hotel coffee shop restaurant spa area even the sea and ocean or near to the hotel so you can enjoy any activities without any headache I recommended this hotel for everyone who like to visit this city ,4
"I spent two nights at this brand new hotel in Rabat. It was just opened in February 2017.  The hotel is really luxurious in a very nice neighborhood with a lot of cafés and restaurants around. Staff are super polite and run to your help.  Just small details that are usually available at 5* hotels are missing to add more value to the stay such as cotton buds, shower cap, shoe shiner...etc.  The only negative thing I can say is that the internet is a little weak inside the room but if you stay next to the door it is better. ",5
Arrived at hotel and was impressed with hospitality shown by Hostess. Spacious rooms with great bathrooms Had breakfast the next morning and thoroughly enjoyed the buffet with assorted Moroccan style choices. Highly recommend this Hotel,5
"I spent 3 nights at the View and loved it. The service was outstanding, the rooms were extremely comfortable and the spa was second to none.    If you're on business travel or just want to relax, this is the hotel of choice. ",5
I really enjoyed my short staying in the View hotel.  The hotel is beautiful and I have everything at my disposal. The swimming pool is perfect for relaxing and the sauna is brilliant. The room was quite and big and the restaurant has some very peculiar delicacies.  Overall the experience was perfect and a special thanks to the people working there. The concierge and all the staff at the reception were very professional and warm at the same time. They were able to fullfill all my requests with zero problems and always smiling. I will be back!,5
"A lot of little issues that added up to an average stay. The bed was comfortable, but the shower smelled of sewer gasses and amenities were minimal.  Room door difficult to lock and no peep hole. Lighting was low, especially in the bathroom. Weird elevator system. Breakfast is very expensive. (Many reasonable restaurants in the immediate area.) ",3
"Modern facilities, and everything worked as intended. Fairly spacious rooms, and the staff is attentive and charming. Excellent food on the ground floor adjacent to the lobby, and a good bar on the top floor. The drawbacks are that, curious for a hotel aimed at business people, the work-space is awkwardly placed and rather small for someone intending to work on a computer, and the chairs are not designed for office use. Also, the rooms are poorly lit, with no direct ceiling lighting; unless you keep the curtains open, the lighting remains gloomy throughout the day.",4
"The hotel building is nice, but beware if you book just one of their basic rooms.  The rooms are very loud with noise from the street since you are put on one of the lowest floors.  Then they provide so little in the price of the room!  Breakfast is an additional 250 DH or $25!  They say there will at least be a kettle in the room, but that's not accurate and you can't even get a coffee or tea without paying $25 for breakfast.  There is no water in the room (or the gym!) and not even a glass for water in the room (although they will sell you a bottle for 60 DH/$6).  The Wifi is weak, particularly at night.  The hotel managers may be trying to make their money back quickly, but skimping on basics like water and coffee probably won't do it.  I am in Rabat frequently for business…",2
Stayed for a few days for business and had no problems at all. It's brand new (beware taxi drivers may not know it yet) and everything works. Staff are pleasant and not too pushy. Security looks good for North African standards. The breakfasts were plentiful and good quality. The Spanish restaurant across the road was very good. Only downside were the lifts - touchpad floor request. A bit too trendy! ,4
"Had a great week staying in this hotel, the rooms are quiet and the staff very helpful, the food in the restaurant is good but the menu was limited. Free Wifi which is not always the fastest but it is ok. The bar on level 14 is great, it offers views of the city on both sides of the hotel. One side is a carpeted lounge bar  with dj serving cocktails the other side is open to the air at one side so you can cool off in the evening breeze. One of the nicest hotels i have stayed in in Rabat.",5
My stay at the view was absolutely pleasurable time and the new hotel was superbly finished and the staff were excellent especially mr Mohammed issam who was at reception who looked after my every need constantly and was extremely professional at all times,5
"Stayed at the hotel for 3 nights during a business trip. The hotel is brand new and well located. The rooftop bar has an amazing view indeed. The staff there was very helpful and friendly. Special thanks to Wafae, Abd el Ghani and Hassan.",5
"I had diner last week at la Sensya restaurant at The View Hotel and let me just start by saying it was wonderful!! First of all, the hotel is really nice and chic, i really liked la Sensya restaurant,  it's cosy and had a nice vibe to it. The food was great, the personnel was very friendly especially the manager. Overall it was a pleasant experience and i will for sure be going back there 👍🏼 ",5
"Restaurant has very nice view.   Service is very slow. Each course takes 1 hour to prepare. And waiter doesn't give enough attention to the tables (maybe it's too crowded?). It takes 30 minutes for them to refill drinking water.   There is no vegetarian option, at least on the day we went.  Food is nothing amazing, considering the price. I ordered a rare steak but got a medium-well done. The steak also came with foie-gras which is not mentioned on the menu. So anyone who is allergic to duck/goose or against foie-gras should beware. ",2
First of all  i  want to thank these very  nice  guest  And profesionnel working nam s  wafa   really she  deserve  a lot professionnels working And lot  of langues soo the is what we nead when we talk about hotels and thank you  too mr othman was  very Nice With us  so  plz keep working and smilling too  these is the Best impression  and professionnels  work so hope to cameback soon ,5
"I was on a business trip from 10th to 14th March at the Cedar Lounge, it's just beautiful with a lovely view of the hay riad 😍😍😍 I was amazed. My 1st day I had a problem with the A/C but the evening manager fixed for me 😍 and then the 2nd day I needed an adapter for my laptop to send important reports for my work and it was the same guy who bought me one from outside the hotel ..... what a amazing manager. his name is khalil 😍. The staff is wonderful, helpful .... I highly recommend it.  P.S : thank you for the nice service and special thanks to the magic gentleman M. Khalil.  Julie  Washington DC",5
"Would definitely recommend the Legend club restaurant; the area is very nice with a breath-taking VIEW of Rabat. The service was very welcoming and professional, a special thank to TAHA and the wonderfull Rayan.",4
