review,rating
"Hotel ambiance, food is excellent. Room size is very average. The most negative part of this hotel is the staff, all are not very verse of English. On reception the staff is not very friendly and not giving a good welcome. They keep you standing while they are busy in their own world, neither they ask the customer to take a seat, until you don't intervene you will have to keep waiting. Room service is also very poor as they take their own good time to respond to your query or request that is made.  ",2
"A truly magnificent hotel with service to match. Every action by the staff is geared toward the comfort of the quest. We booked a massage for my husband and I upon arriving. The spa was well appointed, meticulous clean and tidy. The therapist were obviously highly trained.  The pool area was gorgeous, not a leaf out of place! The hotel was built in 1912 and has many renovations so it is modern but has not lost the luxury of the original intent of the hotel. You get the ultimate service of bygone days in a beautiful up to date hotel. We would not hesitate to stay again. Many thanks for our wonderful experience ",5
"Located in the heart of the city within walking distance to many tourist sites.  Elegant and refined in every detail, yet inviting and warm.  The friendly welcome by M Taoufig, and M Soufiane was appreciated, and their english skills were  impressive.   My room was ready and check in was efficient and quick.  My room 219  exceeded all expectations, air conditioning, free WiFi,and delicious Moroccan sweets.  Breakfast even had Scotch smoked salmon, and fresh squeezed juices every day.  The public areas are gorgeous with beautiful mosaics and a large courtyard, and of course a lovely swimming pool.   The hotel and staff exceeded all expectations, and I look forward to returning next year.",5
"Stayed 2 nights while touring Morocco and had a very pleasant experience. The room was very clean and well kept, the food in the restaurant was okay, the front desk staff were helpful and the breakfast buffet had a wide variety of offerings. We walked from the hotel to the medina in a short period of time, returning at night, and felt very safe.   Two words of caution: 1) don't accept a room on the lower floors if you're unable to walk up and down stairs - they do have an elevator but some rooms still require you to take stairs further down. 2) Count your money at the desk when exchanging!",4
"Today was our last day at La Tour Hassan Palace hotel after a one week stay for business. Also had my husband and nine year old daughter with me on this trip. Room was sparkling clean and the housekeeping staff were exceptional. The hotel itself was very pleasant. The pool was super quiet - my nine year old had it all to herself most afternoons. Room service was excellent and portions sizes were massive. Didn’t try the restaurants so can’t comment on that kind of dining experience. Reception staff were extraordinarily helpful. The guy at the cashier’s desk was very patient when I had a complicated check out (i.e., please charge this to this card and that to that card etc). Younes was phenomenal. He set me up with an awesome driver who took us all over the city and then on to the…",5
I am satisfied with the impeccable services of the hotel. The food variety and test are excellent. The room is excellent. I really thank everyone for making my stay amazing. not only the hotel service is perfect but its location is also.  I highly recommend the hotel for others and definitely will stay next time.,5
"Stayed at this hotel during a trip to attend a wedding in Rabat.  We were originally planning to stay elsewhere and had to change last-minute to here and have no regrets whatsoever.  The various restaurants have all been good; the breakfast buffet in the l’Imperial is opulent and delicious.  The staff are always eager to be helpful.  The Moroccan restaurant (Maison Arabe) is not to be missed.  Easy to get transportation with either a taxi or Careem, and not far from the main places you’ll want to visit in Rabat.  The king-sized bed in our suite is comfortable although I personally prefer less puffy pillows.  WiFi has been fine (which is a must in Morocco, given the exorbitant rates for international cellular data service).  You’ll note a lot of security while visiting this…",5
"The hotel is part of the culture of Morocco and Rabat as opposed to a ""chain"" experience.  The staff is highly professional, well trained, accommodating and amazingly friendly.  The rooms might be smaller, but immaculate and well maintained.  Moroccan elegant.  Nothing shabby at all.  Work out room is not extravagant, but well equipped for the basics and accessible with a nice view to the courtyard.  Centrally located to business, the train station, the Medina and restaurants, a lot within walking distance.  Staff usually recognizes you as a guest going and coming or around the facilities.  Really nice touch in personal follow up after a stay from guest relations to make sure everything was satisfactory and keep you coming back.  ",5
"Posh, elite, upscale, elegant.THE place to stay in Rabat. Dignitaries coming & going, foreign government officials, heads of state, security details everywhere, dramatic limousine arrivals and departures, quite exciting! We loved our stay so much. Our room had a great view of the gardens, pool, and fountains. The breakfast was just wonderful...excellent service! Live music in the Trendy Bar in the evenings. The new spa just opened...perfect! Would stay again on our next trip to Rabat.",5
"We initially had an Airbnb that was cancelled on us and Airbnb provided us with a credit to use towards any accommodation. We decided to book at La Tour Hassan Palace. I have to say the stay was excellent..partly because we went from a $26/night Airbnb to a $270/night hotel!  We were upgraded to the garden view room which had a king bed, and view of the garden. Everything was very clean, sheets were nice and washroom was big. They also had a currency exchange available at good rates(better than Casablanca airport).  Staff were friendly and they helped hail a cab for us. WiFi was excellent. Location was decent..about 15 mins walk to the Medina. You can always take a taxi for about 15dh which is like $2.   I highly recommend this hotel but would only stay here because our stay was…",5
"I stayed at the hotel for a week. Which was very short and very enjoyable. The room was very good though small, nice delicious meals and kind staff. The hotel is placed at a very convenient place a center of many things, tourist places, market, banks, train station .",5
"When we arrived at the Tour Hassan Palace, we discovered that the advertised parking was on the street, not in a garage. The check in was friendly but it took a long time. When we finally got to the room, the key would not work in the lock. When I tried to call reception, the phone did not work so I had to walk downstairs to get help in locking the door. Then, we decided to eat at the hotel but the restaurants were deserted, perhaps because they were really overpriced. Finally, when I took a bath and my husband took a shower in the newly redecorated bathroom, it flooded.  What good is it to have a  heated toilet seat and fancy shower jets if the drains don’t work? The water was so deep that it spilled into the carpeted hallway and the bathroom was unusable. I also could not help…",2
"Without doubt one of the favorite hotels I stayed during my time in Morocco. Upon arrival we were warmly welcomed by the personnel. Once you get in the beautiful mauresque architecture overwhelm us like if we were traveling centuries back in time. The staff was extremely friendly especially M. Houda Bouadya, she was affable and very professional always there when we need her.  The hotel have a good emplacement in the city center with some shops nearby where i bought a doudou as a souvenir and the atmosphere there is so special that it really felt like home to me. All respect for all the guest relation staff who does a great job here; a true sample of the Moroccan excellent hospitality!",5
"We stayed at this very fine hotel in Rabat for the first two nights of our Morocco tour with Gate 1. This is a very upscale hotel in the heart of the city. Upon arrival we were given Moroccan mint tea and some small pastries. We were then assigned our room.   The hotel is beautiful with elaborate mosaics on almost all surfaces in the public areas. There is also a large courtyard that is beautifully landscaped with a large pool and wading pool. Rabat is the capital of Morocco and this hotel is near the parliament. Quite a few of the government officials were also staying at the hotel and it was quite interesting to see them all decked out in their robes, turbans, fez's and other garb. I was tempted to take a photo or two but thought it would be a bit too rude.  Our room was much…",4
"La Tour Hassan Palace is a beautiful hotel that retained stunning mosaic art that Morocco is known, which can be appreciated all over the compound.  It is within walking distance to Medina.  Service is warm, professional and of high quality.  Spa was amazing and the meals including dessert/pastries served at restaurants were excellent!  ",5
"A charming hotel with high quality of services, nice food and accommodation. The location, near downtown, is well appreciated together with an upgrade to a deluxe room with its nice view on the Andalous garden.",4
"A colleague and I stayed there in April 2019 and had an amazing visit.  Close to the Old Medina markets.  The room was well-appointed; the food at the restaurants terrific.  We ate at the Moroccan restaurant (really delightful and not outrageously priced for dinner) and the ""western"" restaurant for lunch.  The staff were also flexible with they hit a glitch with my business credit card and arranged by transit to the airport early morning when I left for home.  Highly recommend this hotel.",5
"Enjoyed stay, good food at breakfast and in restaurant. All the staff were very helpful and attentive especially Houda on Guest Relations who quickly resolved any queries to a satisfactory conclusion.",5
"Check-in took quite a long time. Room was so hot and was told to open the window but not ideal because of mosquitoes and other insects. However, Houda is very friendly and helpful because I knew her since she was working at Sofitel Jardin des Roses.",3
"Staying at this hotel is a pleasure. From check-in to check-out, the service from the staff is efficient and pleasant.  The hotel itself is beautiful, and the rooms are comfortable and quiet. Good fitness center, and nice outdoor pool.  Excellent breakfast, with again great service.",5
"This hotel lives up to it's name. It is absolutely a Palace with an unbelievable staff that treats each guest like royalty.   With every amenity right on the property such as authentic restaurants, bars with live music almost every night, comfortable indoor and outdoor lounge areas, a beautiful pool with fountains, a relaxing spa and massage facility, fitness center, business and conference rooms, Wifi, 24 hour room service, laundry and dry cleaning service, evening turn down service and the most caring, welcoming, and attentive staff I've ever had the pleasure of working with.   I thank you again Ms. Houda Bouadya with Guest Relations, as well as the entire staff for treating us like family and making us feel at home. After a three week stay, we were very sad to leave but…",5
"I loved my stay here and would like to commend the staff and their dedication. The check in and check out was smooth the room was comfortable as well. Loved the Moroccan sweets kept to welcome us. Their Arabian restaurant is a must go and the food is delicious with live local musicians playing  music :). I would especially like to thank Houda Bouadya  for being really helpful and giving all the right information to visit the city. She is great and very very helpful. The breakfast is good and provides wide variety, the gym however is small and have limited equipment. Overall, i enjoyed my stay here.",4
"We stayed here for a week-long work event in April and the service, food, and friendliness were all something to write home about.  The food in Rabat was very good generally, and Moroccan cuisine excellent, but the hotel's buffet breakfast and lunch provided for the event was plentiful in choices across the board, from fresh salads, broad choice of proteins--seafood, fish, meats, poulty--and delicious traditional dishes like couscous.  The service was so friendly.  Houda Bouadya from Guest Relations helped us with various requests, such as helping to book massage in the city, or the front desk for suggesting good restaurants to try.  Rabat felt very safe, and it was a beautiful time of year to visit.  The ocean air and breeze permeates the city, which was more green and verdant…",5
"Spent 4 days for a business trip. This hotel is one of the best I have stayed in. From Check in, to meals, the SPA and the pool area, it was fantastic. I would not stay anywhere else in RABAT. Houda Bouadya of guest relations is absolutely the best!!",5
" I took lunch in the quiet & beautiful setting by the pool overlooking the garden, this is the best decision i made since i was in a hurry and only in Rabat for half a day ! so i decided to come experience this hidden gem in the heart of the city. The staff is welcoming and very professional especially Ms. Houda from guest relations who showed me around - in a professional and yet very friendly manner - every corner of the great facilities this hotel has to offer. She even took care of my phone as my battery was dying so i enjoyed my lunch stress free :)  I would definitely come back again and hopefully for a longer period of time ! Highly recommanded !",5
Wonderful stay great location! This is my second stay at the hotel for my business and leisures travel. Each time is way better than the next! Houda Bouadya of guest relations is absolutely wonderful!  ,5
The air conditioning didn’t work. The front desk said open the window. The room was still very hot for sleeping. They advertise A/C in the brochure.  It turns out that coffee pods for the coffee maker in the room are only provided for the first night you must pay extra if you stay more than one night. This is after paying $US 360/ night.  Service was poor for breakfast but the choices and variety was great.  ,3
"The hotel is very impressive, with good size rooms and bath, and great storage. Very clean. Lovely lobby. Helpful staff. Excellent breakfast with great variety. Rooms built around a beautiful courtyard with gardens and a pool in one section of it.   The problems were specific to me, but I’m writing in case they might be applicable to readers. We visited in March, which is a shoulder season in terms of climate. Days are warm enough for shirtsleeves, but at night one needs a jacket. The hotel’s heating and air conditioning system allows for only heat OR A/C. The heat was on while we were there, which meant that the rooms were uncomfortably warm during the day and even at night they didn’t cool down unless one left the screenless windows open. There was no way to get the system to…",4
The Hotel was a great experience. The mattress was really comfortable and the cushions excellent. WiFi worked well throughout the Hotel.  The Food was well prepared and presented. Plenty of storage for clothes and Toiletries. The Housekeeping was good replacing used items from bathroom and capsules for Nespresso machine. Staff were helpful and friendly. Bath was huge and needed ages to fill.  I did not understand why it needed to be so deep. I enjoyed my visit.  I was part of a Tour Group and we all loved it.,5
"I have invited my parents to stay at the hotel, they were warmly welcomed and were offered a free upgrade and cake for their wedding anniversary. I definitely recommend this hotel for the impeccable service.",5
"La Tour - the good - a lovely facility in a great location close to the Medina and within walking distance of Chellah and other sites. Rooms are nice and staff is helpful. Wifi is excellent and free.  Breakfast buffet is very good. The marginal - air conditioning is a 2 pipe system meaning that you either have heat or a/c so that when we were there in February the hotel was in heat mode so the a/c blew only hot air requiring open windows most of the time. Not surprising for a hotel operating since 1914, but not 4 or 5 star either. Other details were missing like wash cloths, and coffee was sporadic as was bottled water. Unfortunately I have no experience with other hotels in Rabat to compare.",3
"I just spent 4 wonderful nights at this hotel..I was greeted by very friendly helpful staff and Houda, with her lovely smile and friendly attitude.   The spacious lobby smelled of roses. My room was large with a couch, 2 chairs,  small table, king bed, a safe,Samsung TV and beautiful marble bathroom...I visited the spa for hammam (scrubbing) and massage, a beautiful experience.   I had dinner once in the Moroccan restaurant (tagine of chicken and apricots--just delicious..two musicians played oud and drum..it was delightful...two nights I dined in the international restaurant,  perfectly prepared lamb chops on one night, duck the next. The wait staff was outstanding all 3 nights...a great thing about this hotel is its proximity to museum of art, soul and Hassan tower.  I walked…",5
"My first time in Morocco, and I was blown away with this beautiful palace hotel.  The spa was very relaxing, too bad it was too cold for pool.  The Moroccan restaurant had wonderful food, as well as the breakfast buffet.  The room was large, well appointed very comfortable.  Staff was friendly and helpful.",5
"I've stayed in La Tour Hassan last week and had a fabulous experience.  I was there for work with one of my colleagues and we booked the huge meeting room for the full day for an event of the company we work for.   When we arrived the 21st of January, Houda gave us a very warm welcome and showed us our rooms. We even received a free upgrade to a room with a garden view.  She showed us the meeting room together with one of the event coordinators. I was very impressed with Houda's fluency in English.   The event was very well arranged by the hotel staff and multiple times a day they asked us if we needed anything. So helpful!  The breakfast was amazing, fresh juices everyday!   10/10! We will definitely return to this beautiful hotel!",5
I am staying here on business trip for a few days. The Hotel is really nice. So far the service is very good. The fitness gym has all I need to keep up on my fitness regime. The Spa is excellent. I will definitely go again before I leave.,5
"Second time staying here,service staff, especially the front desk staff, was fantastic. Room was extra clean and well stocked. plenty of pillows and snacks in the room. The restaurants in the hotel are all worth trying and the best part is the short walk to the Medina. Everyone is very friendly and will go out of their way to assist . Will definitely stay here again",5
"I was there on business. The staff were friendly and helpful at all times, specially Ms. Houda Bouadya from guest relations, who ensured that everything was perfect right from check-in. The service was excellent and the food was equally good and the staff friendly and helpful. The hotel is centrally located and hence ease to attend business meetings as well as enjoying the sites of Rabat. Definitely worth a return visit, but this time for leisure.",5
"I received an excellent service, great greeting by the young lady at the service desk and a wonderful massage by souad.  Next time I come back to this hotel I will definitely have an other massage session and I highly recommend the spa services. Thank you very much ladies for your sens of high level service.",5
"I was there for business and the banquet staff was very attentive, helped us when we had questions or issues and was very hospitable. The hotel is beautiful. So much detail in everything about it. The food was great. The room is a little bit small but not to where it was an inconvenience or anything. The only bad thing is that to me, the weather was warm my first few days but the whole property is on a centralized heating/cooling system and to them, it was winter weather. So my room was a little hot the first couple of days until the weather did cool down. It's within walking distance of many great restaurants as well as the medina where you can do some fun souvenir shopping. It's also within walking distance to the beach and the Oudayas.",5
"The hotel was great and especially Ms.Houda Bouadya from guest  relations made my trip more special with her kind and caring treatment.   The rooms were clean, comfortable and quiet. Overall I am satisfied with my stay.",5
"A very amazing experience at Tour Hassan Hotel with warm welcomr, top quality services and very nice building in the heart of Rabat. I would definitely recommend this hotel especially for business travellers! ",5
"Excellent room (very big,comfortable bed and pillows),,great food( tasty and big portions),,friendly staff,location is good ,,room service is fair quick,WIFI very effiecient,the only thing that need to be revised is tv channels where they need to have arabic movies channel",5
"The hotel facilities were so amazing and variable. Also, the staff was so helpful and hospitable. Particularly, the way that their Guest Relation, Houda Bouadya, treated me was so commendable and professional. Eventually, if I am planning to visit Rabat again, La Tour Hassan Hotel will be the idealistic place to stay in.",5
"I was on a business trip and colleagues made this booking for me. Great location and impressive decor. Don't miss an opportunity to dine in the national restaurant. The staff was very kind and very helpful with information about getting around Rabat, especially Ms. Houda, from the guest relations. Definitely recommending this hotel.",5
"This month, my wife and I took a vacation to Morocco and our first stop was La Tour Hassan Palace hotel in Rabat.This hotel is located in the center of town and its staff gave us a great welcome. The room was cleaned more than once a day with fresh linen and bottles of water. The reception area was furnished well and its gardens were groomed quite frequently. The hotel has three restaurants and each one offered and served specialty food for every taste. Their customer services were exceptionally professional and friendly. The concierge Ms. Houda Bouadya was a great resource, always available and ready with a recommendation and destination. This hotel gave us a great first experience for our vacation to Morocco. We strongly recommend this hotel when visiting Rabat. DB New York…",5
This is a great hotel  very good attention from personal.  Specially from Houda very helpful on the places that you can visit nearby. This hotel is in the heart of Rabat. There are a lot of tourist places nearby also restaurants train station.  Thanks for making my stay very nice,5
