review,rating
"We spent are first night in Morocco at this lovely hotel. It is well situated. The staff was very helpful especially Abdellatif Lotfi rooms operations manager. He went out of his way to make sure we were comfortable and happy with our room. The room was large, well appointed and comfortable.  Thank you Abdellatif.",5
"Though only staying for one night La Tour Hassan Palace was a very pleasant place to be. Good sized bedroom and bathroom overlooking the pool.  Very well maintained, the whole place oozed quality. Hotel a mix of the traditional and the modern. The area around the pool offered shade from the hot sun and good quality bar meals were available here. Breakfast offers a large choice and is also taken by the pool. The staff at all times were extremely good, pleasant and efficient. Very highly recommended.",5
"Lovely hotel but lacking in service.  At the pool in afternoon. Everyone standing around. No one came to offer service. Finally went up to bar to request service. Told someone would be out. No one came. Once again went to bar, ordered. Took 45 minutes to receive 2 drinks!  Made reservation for a car pickup to go to,a restaurant. Never e arrived. After 30 minutes got a taxi from street. Manager never available during those times.",5
"This hotel is very impressive. I would say it’s more on the scale to a higher end hotel. From check in to check out everything was just perfect. The staff were wonderful. It was my birthday and they surprised me by brining a cake to our room. That was the most sweetest, kindest and thoughtful thing someone could do. I really appreciated that and thank you to all of you at the Hassan Palace. Our room was so beautiful and comfortable. The breakfast was really good. You’re made to feel that it was all especially prepared for you. The pool was nice but water was very cold. We also experienced our first hamman here and it was really the best.  The hotel is close to town and walking distance to the Medina.",5
"A wonderful hotel.  We spent two nights there . Great service,  wonderful assortment for breakfast, comfortable room spacious and clean, easy access to major sights and restaurants. Highly recommend. Beautiful garden.",5
"LOVELY hotel!  This was our ""splurge"" while in Morocco, but it was well worth it.  Lovely staff, lobby, pool area, etc.  The rooms are clean, but a bit small.  However, the service was impeccable.  Every night there was a knock on the door to see if we needed anything.  If we didn't, they handed us chocolates :)  Would highly recommend!",5
"We stayed here for three nights during the summer and had a wonderful experience. The staff was all very friendly, and fluent in English / French / Moroccan Arabic. Any small or minor issue that came up was resolved quickly. Breakfast is incredible -- good mix of Moroccan-style breakfast foods and more ""western"" style foods.  The ""gym"" is about what you'd expect from a hotel gym, but unfortunately only one of the treadmills was working so had to wait a little while to jog. The free weights and machines were well maintained.  Room was comfortable and had a nice view of the interior courtyard. Room service takes about 45 minutes and seems to come from the restaurants (very wide variety of food, and very high quality).   Location is excellent -- you can walk from the train station (about 10 minutes), and also to the waterfront / market areas.  Finally, the building itself is stunning -- it's a beautiful mix of old, traditional Moroccan tiles and mosaics and fountains, with a modern flare.   Highly recommend:  - Get something to eat from the Moroccan restaurant. We had a chicken tagine that was incredible, and the fish was very good too.  - Spend some time by the pool. There is seating in the shade and sun, and the ambiance / surroundings are beautiful and relaxing.  - Have a drink on the outdoor patio and enjoy the architecture. Don't take the beautiful building for granted!…",5
"Highly recommended!  Our family enjoyed staying at the Tour Hassan Palace Hotel for a week.  Our room was spacious, quiet and clean with a lovely view of the courtyard and pool.  Breakfast was a generous buffet of fresh juices and fruits, breads and pastries and custom-cooked egg dishes and crepes as well as hot and cold traditional Moroccan food.  We ate dinner there several evenings and the food was wonderful. Staff were attentive and helpful arranging taxis.  Location is good, in walking distance of the old waterfront area and markets as well as the Tour Hassan itself.  We would be happy to return.",5
"As pilot flying to Rabat I’m used to come to La tour Hassan hotel. It’s always a great pleasure to come here. Always a warm welcome and I feel like home. Service is warm and welcoming in every part of the hotel. It’s very clean, rooms are calm and the food is great. Small but beautiful spa. No way to go elsewhere 🙆",5
"Had a lunch in the epicurien restaurant , and it was amazing , so pleased about the hospitality and the joyful conversation of the mettre of the restaurant monsieur Mohamed  that made us enjoying our lunch  and the food was very delicious food  a bit expensive but it worth it , very charming table next to the pool with a nice view of the garden , nice experience",5
"This hotel was lovely from start to finish. Every staff member we met was helpful, friendly. They arranged cars for us. Made recommendations. Once we had eaten in the hotel restaurant (DELICIOUS) a couple tunes they started making suggestions and one might even brought some special menu items as they prepare to bring back (since Covid) more dining options in July.  The food was amazing. Good presentation. Delicious and creative and interesting. Food Service a little slow for our American personalities but I think this was also due to just scaling back up now from Covid cutbacks.  The breakfast buffet!!! So good",5
"This hotel is such an amazing place to be. You just can't miss it. I dearly encourage guests and tourists to make this beautiful and warm receptive hotel their home. The Moroccan food is just too tasteful and satisfying. Special gratitude to Dalal, she is very much resourceful, kind and helpful. Enjoy the moment in this great hotel of Rabat, the city of life.",5
I want to thank the whole team of the hotel especially the receptionist Najwa and also Dalal who took the trouble to move and meet our needs. Big thanks for you ! We became a loyal guest to La Tour Hassan Palace haha ! Thank you Rabat 💐 thank you Morocco ,4
"We stayed here for six nights and enjoyed every moment of its quiet Moroccan charm and excellent service. Conveniently located in downtown Rabat, the hotel combines old-fashioned elegance with modern amenities.  Scrumptious and copious breakfast buffets were enjoyed in the lovely garden, and dinners by the pool were enlivened by delightful conversations in English, French, and Franglais with our charming waiter Mohammed Bentaher.  The only fault was the enormous and heavy duvet on the otherwise comfortable bed--it was too hot for June!",5
"When we first arrived, the hotel had overbooked (supposedly with some part of the Moroccan royal entourage) and they had to rebook us for one night elsewhere.  We were so disappointed, but lovely English-speaking manager Ayoub said we could use the breakfasts, the terrace, the pool, and still be a guest, just sleeping a few meters away.  By the next morning we were booked into the Tour Hassan Palace for the next couple of nights.  We enjoyed its lovely touches, extreme cleanness, gracious setting right next to all the Rabat sights, this place was a haven after busy tourist days!  The breakfast buffet and eating area was scrumptious in every way.  The best kind of Moroccan hospitality among all the employees, including in the restaurants.  This was a splurge for us, and worth it.",5
"I have stayed here several times and every time is perfect. The hotel staff are extremely helpful and knowledgeable. The rooms are beautiful, comfortable, and always very clean. Younes and Najwa are always incredibly welcoming and helpful. If you ever stay in Rabat, I definitely recommend this hotel. It’s within walking distance of great and affordable restaurants as well as the Medina and other places to go sight seeing.",5
"We booked 4 deluxe rooms.When arriving hotel we were the only guest but still check in took 20 minutes. The rooms were nice but could be in better condition including cleaning. Only 1 small water bottle( very unusual  for Morocco) No coffee ,no Tea( cattle and coffee maker were in the room)When I asked for coffee or tea and water, I was told that this is on extra charge. No shower cap,no laundry bag ,no pencil. Next morning next unpleasant meeting.It took us about 40 minutes and around 12 requests to receive coffee and tea.For the bread someone ales got angry and not me.The same for receiving a Yogurt or a spoon. When we asked to complain and to receive a compensation only after our persistence and not relinquish they sad we could have dinner on there account in the hotel.We…",1
This hotel is a generous helping of Moroccon hospitality. It clearly is the choice of stay for statesmen and celebrities and it is clear why. Space and cleanliness internally and then gardens of paradise outside. Good food selection. Not the cheapest by far in Rabat but you are paying for history and class.,5
"This is an excellent, luxury hotel in the heart off Rabat. It boasts Rabat's best restaurant, with magical Tajines to tempt the palate. Comfortable rooms with massive king-sized beds. Good free WiFi. Nice helpful staff. Lovely gardens and pool. No wonder this hotel has played host to international stars and celebrities.",5
The amount of cultural appropriation in this hotel is unbelievable.  All the pictures and paintings on the walls belong to Algeria.  women in photos were wearing Algerian Traditional Attires yet they were claimed to be Moroccan  this made me question everything I have seen in Morocco.,1
"We are an Algerian couple we stayed at this hotel last April to visit our friends the problem we encountered is The amount of cultural appropriation at this hotel is unbelievable. All photos and paintings on the walls belong to Algeria. the women in the photos were wearing traditional Algerian outfits but they were claimed to be Moroccan, this made me question everything I have seen in Morocco",1
"My wife and I arrived on an 80+ degree day and was shocked there was no air conditioning in the hotel. It’s extremely difficult to sleep in those conditions. We tried to open the window only to be serenaded by barking dogs all night. To make things worse the bed was very hard and was not at all comfortable. So needless to say we didn’t get any sleep when we were there. Stay away, especially in the summer.",2
"We stayed at the Tour Hassan Palace for 3 nights before starting our tour of Morocco. It was wonderful. Located right in the heart of the City. The staff was very attentive, went above and beyond to provide the information and services we needed. The accommodations were wonderful, the breakfast perfect and the evening meal to break the fast was fantastic! We scheduled massages; they were wonderful and the grounds were manicured to perfection. I would highly recommend!",5
"My wife and I spent two nights at La Tour Hassan at the end of February 2022.  Overall, it was a nice stay with only one issue.  As I understood the history of the hotel, it was built in 1915 and has been renovated several times.  Presently, the hotel is very modern but retains its original geometric decorations.  The present main entrance is at ground level (-1 on the elevator).  The original entrance can be seen and is quite ornate, but involved quite a number of steps, which is a problem for disabled access.  The neighborhood appears to be safe.  We walked around the neighborhood and never felt unsafe.   The staff has been excellent – they are polite and ready to help.  All the staff that I had interaction with spoke good English.  Our room was adequately large.  It had a…",4
"We had the most wonderful time at the hotel. You feel good from the moment you arrive. The receptionists are very professional and above all friendly. Very good gastronomy; you risk getting fat by eating well;) ;)... Smiling, helpful, attentive, calm, etc.",5
"We stayed at the hotel for 4 weeks on a business trip. Staff were friendly and helpful, great location near the bazaar and river, with lots of good bars and restaurants nearby. Rooms were spacious and clean, the toiletries were excellent, all argan based. Wifi is strong and stable.   We would have given it a 5 star if it wasn’t for the gym which was a big disappointment. Most of the machines don’t work, if they do, they’re grimy. There are no towels, water nor sanitizers to wipe up before or after use. The mats were smelly and dirty. The machines are stained and grimy.   It’s such a shame because the view from the gym is overlooking the pool which was beautiful. We hope they improve this area. ",4
We are staying at Tour Hassan Palace as a group for the past 10 days. I can only say the hotel and staff have been excellent. Given the current situation they have gone the extra mile to ensure our visit is of the highest quality. The rooms are comfortable and all amenities are of a high standard. Housekeeping always do a great job and make sure the room is clean and tidy. The restaurant and Bar staff are most accommodating to our needs and we enjoy a very nice breakfast daily with plenty of variety. Overall I would recommend this property and look forward to returning,5
"I would like to thank for such a  wonderful stay in this lovely resort . Spacious and clean room , nice pool and lovely garden where you can enjoy your meal or just have a relaxing day . Absolutely lovely and attentive staff especially  Mr.Nabil and Mr. B.Mohamed . Look forward for another visit.",5
"Stay in this hotel left us with a very bad aftertaste about the city of Rabat, which they represent for tourist coming for one night to stay. Unfortunately the management does not seem to understand this simple fact.  Because of this experience I will recommend to avid Rabat to everyone who will ask.  The hotel is well maintained and the rooms are fairly comfortable. What tipped us off was the food. Their restaurant is probably the worst one we had in Morocco. Incredible bland and uninspiring. There was not a single item, out of 6 we tried, we liked. All tagines hand exactly the same taste - unseasoned.  The way they treated us with respect to breakfast was simply disguising. At the check in we were informed that the breakfast buffet starts at 7:30.  We showed up at 8 to find…",2
"As I came many times in Morocco i did morrocan bath quite often but I didnt know the real one till i met Meryem! She s just the best! I couldnt enjoy it more than this!ill come back for her, definitely! Shukran!",5
"I feel that its mandatory to review this place. They respected all the measures of COVID-19, that I was afraid of. It was an amazing experience, and I am happy to discover such a wonderful hotel. Thank you for your hospitality and professionalism.",5
"This hotel is great.  Large comfortable rooms, beautiful courtyard and garden.  The breakfast is simply amazing.  Staff wonderful, as are all service industry people in Morocco so far.  Only reason not five stars is, as others have mentioned, it was not possible to turn on the air conditioning in February but it was quite warm.  There is a very large window which can be opened, and that cools the room,  but then the outside noises come in.  Which were minimal and included nice music.  At the next update it would be good if the guest could choose whether they want heat or air or neither.   The outdoor bar was delightful.  I wandered to it by mistake so not sure which floor it is on.  Up at least a level from the courtyard and main restaurant.  Overall, highly recommended property…",4
Our group stayed here for one night. Beautiful lobby and bar. The room wasn’t as Impressive. Great breakfast included with the room. Great selection of both hot and cold items. Delicious pastries too!,4
"This hotel is very nice. Many pros and only a few cons.  The room (221) was nice and faced a courtyard. The room was a little warm, and once I realized that both the AC and Heat settings on the thermostat blew warm air, I turned it off. BIG window along the wall facing the courtyard, and that stayed open most of my stay.  The room was well appointed. There was a plate of cookies and bottled water upon arrival.  Our group ate at two of the restaurants, La Maison Arabe and L'Epicurien. We had breakfast included which was served in the Imperial restaurant.  All the food was very good and well priced (i.e. relatively inexpensive for a hotel restaurant). The breakfast buffet was very good and very broad. Fresh fruit was wonderful and the fresh juices were a great way to start the…",5
Very popular long standing hotel in a Spanish style with a attentive staff. Large rooms with several quirks. The AC and heat cannot be run at the same time. One or the other is activated at different times of the year. The tub shower with a half glass is very high with NO safety grab bars to help getting in or out. The speed buttons on the phone did not work and we found it hard to reach the front desk. You have to dial a direct number which was not posted by the phone. Recommend. Hope this helps.,4
"What a great hotel. The room was just lovely and staff so helpful and friendly. Really enjoyed my stay there and would definitely recommend. The food in the Moroccan restaurant was superb, the best dining experience I had in Morocco",5
"This was our first stay during our 2 weeks in Morocco.  The hotel lobby is absolutely beautiful-ornate tile work and comfortable seating areas.  Dates and fresh fruit always available.  The waterfall outside was eye catching.  The pool area and grounds were very nice.  Our first room was very stuffy, so we opened the window.  The room backed up to the kitchen so we immediately heard all the kitchen noise.  The cooking odors quickly permeated the whole room.  Plus the electronic safe didn't work.  We were able to change rooms to one overlooking the pool area.  It was so much better-quieter and without the cooking smells...and the safe worked!  The bath amenities were really nice and fragrant.  There was a plate of yummy cookies and a plate of fruit plus bottled water. The…",4
"Room, clean and comfy but very small for 2. Unable to walk around bed if desk being used. High supplement for double occupancy. Had to ask for more towels, glasses etc as only set up for one. Never did get an extra cup! Tea and coffee making facilities: 2 coffee pods for whole weeks stay and no teabags (available at cost). Never in 40 years of world travel have I ever stayed in a hotel, Riad, bed and breakfast or apartment and been charged for tea bags. A few hours late checkout, charged at 50% of room rate. Breakfast cost £25, cafe close by was £2.50 (fresh juice, eggs, olives, bread, tea or coffee). Charged extra £50 on final bill, reception staff somewhat miffed when we noticed. Will go elsewhere on our next visit to Rabat.",3
"This is an excellent hotel, with excellent service. I was here only one night, but it was a pleasant stay. The room was quiet, large and clean, the bed was comfortable. The bathroom was large and clean. I would stay here again.",5
"A Lovely comfortable room. Enjoyable breakfast, filling and had a nice Moroccan feel. Stunning pool area.... Didn't get to use the pool but the view from the room was beautiful, and walking in the area was relaxing. Hotel was well situated, and I enjoyed walking in the area around the hotel.",4
"Every year I visit I am impressed with the experience. Hotel smells nice, looks nice and is very comfortable. I look forward to the Spa every year. The warm reception at the door is always something I can count on.",5
Hotel is nice but my room could have been larger and was a bit dated. Mattress needed to be flipped over as there were hollows on each side of the bed. Nice breakfast buffet. Staff members are overall nice and professional.,4
"Great hotel, and staff. True Moroccan experience. Service was exceptional. Garden and pool wonderful. Right in the center of town easy to get around to many cool places. I have to say the food was very good. The overall experience was very relaxed and charming. ",5
We really enjoyed our brief stay at this hotel. It was centrally located within walking distance of the major sites in Rabat. There were many restaurant options within walking distance as well. We also had a great time at the spa with a luxurious hammam.,5
Close to old city and wonderful service and restaurants.  I strongly recommend this hotel for a short or long stay.  I would be happy to stay there again.  I am a regular global business traveler and La Tour Hassan sets a high standard.,5
"Good food and good location.  I was able to walk to the main boulevard as well as the Kasbah but the real test came when my wife discovered, on Day 1, that she needed batteries for her electric tooth brush.  After explaining what I needed and the size, one of the desk clerks ask for some money and volunteered to go get them for me.  When he returned, he called my room and I came down and got them and my change.  The batteries turned out to be about half of what I would have paid in the U.S.  Clerk then refused a tip.  I cannot imagine getting this kind of service in any major city hotel in the U.S.  We would definitely stay there again should the opportunity to do so present itself.",4
"La Tour Hassan is a nice large hotel with all the amenities you would expect of a four-star hotel. (They are not quite a five-star hotel, in my opinion, but they are still good.)   The interior has a lot of Moroccan charm, and there are nooks and crannies throughout the place to sit and enjoy a tea and conversation. The outdoor area is lovely and the restaurant (Maison Arabe) on-site is quite nice. Breakfast is varied with fresh options as well as many pastries and hot dishes. The wait staff is friendly, attentive, and aims to please. The front desk is also amiable and does its best to make guests happy.  There's a small ""business center"" with a couple computers and a printer. And the location is very near to the medina and other things you might want to see in Rabat.  We used…",4
The hotel is historic and full of beautiful tile as one would hope to find in Morocco. There is a large and beautiful inner courtyard with a nice pool. Our room was huge. Everyone was friendly. The hotel is in the center of town.,5
We arrived from Paris and our group were provided a bus for transportation to the hotel.   Weather was very good.   Good to bring some light extra layers of clothes as the evenings mat be a little cooler than the days.   The staff quickly checked us into our rooms for a welcome rest.,5
"Really enjoyed my stay here. We were there for a night in November, Rooms definitely have a luxurious feel, and the location is perfect if you’re willing to visit Rabat.  An Amazing rooftop and exceptional jazz bar with live music show, the service was exceptional , the quality of food specially the breakfast was stoning, I tried the Moroccan soup Harira and a special oil called ARGAN oil, and a special almond butter called Amelou , it was amazing and very tasty, although it was raining this morning but people made feel so welcome  Thank you",5
"The Tour Hassan Palace in Rabat is absolutely Exceptional! What a destination. Honestly the service the cleanliness the staff absolutely everything was perfect.  This was our Our second stay at this hotel this year, we came in on the 27 October and left on the 1st November. It was even better than the first. Upgraded to a beautiful suite, all the staff were friendly and helpful especially at breakfast where we had the best breakfast ever in Morocco, the pool staff was amzing, and the Moroccan restaurant was so delicious that we decided to have diner twice in our stay.  Thank you hope will come back on january",5
"This was an amazing stay in, we were there  with travl link for two nights, people were very nice, the breakfast was wonderfull, with a huge choice of vienoiserie, salads, eggs and some moroccan pastries , the waiters were very attentive, rooms were very clean, and the sight on the garden was just wonderfull, thank you again, hope will stay there another time",5
"The hotel is in a prime location close to lots of restaurants, the Medina, downtown, grocery store, historic sites, etc.  Rooms are clean but small.  Very nice garden, lots of coaches/chairs to sit, relax, and enjoy a meal.  Nice small gym but no air conditioner; they need to have sanitizer to clean the equipment before and after use by guest.  The concierge should have a basic understanding of English.  Morocco is a beautiful country and lots of tourists visit.  This is supposedly a five star hotel and the staff should have an average knowledge of English.",4
"We were part of a tour group that spent two nights at the La Tour Hassan Palace. This is a superior hotel and well-located in the heart of Rabat. The accommodations were very nice. The hotel features a beautiful courtyard with gardens and a pool that invite the visitor to relax and enjoy the hotel. It was quiet with very good service. Our luggage was misplaced on our arrival, but the staff immediately started a search and found our luggage quickly (it had been mislabeled by the tour company). The hotel restaurant provided us with a buffet that satisfied everyone's appetite. The breakfast bar was well supplied with fruits, pastries, cereals, eggs, meat, cheese, etc. I recommend La Tour Hassan Palace as a place to stay in Rabat.",5
